{"schemaVersion": 1, "editorVersion": "0.5.0", "juceVersion": "JUCE v9.0.0", "testedAt": "2026-08-12T23:15:03.984+02:00", "inventoryPath": "plugin-inventory.json", "quarantinePath": "plugin-quarantine.json", "alternateProjectPath": "m4-accepted-candidate-b.resonance.json", "noRescanPerformed": true, "audioEmitted": false, "runtimeCapacity": 8, "device": {"type": "Windows Audio", "name": "Speakers (Bose Mini SoundLink)", "sampleRate": 44100.0, "blockSize": 441}, "plugin": {"identifier": "VST3-Surge XT-b793f78b-190e4fbd", "name": "Surge XT", "version": "1.3.4", "expectedParameterCount": 2855, "firstParameterCount": 2855, "secondParameterCount": 2855, "distinctInstances": true, "firstStateBytes": 67345, "secondStateBytes": 67345, "alternateStateBytes": 76829, "alternateStateSha256": "ccaf99d4dc86d0b272e6ff1cc3be8afd07349bbcfe5055d992a001bea74da308", "normalisedAlternateStateSha256": "91ed214e64b35e95cf20ca773ccf57f650bbeecb547d1aa5f0ba8a2f2f5c36a3", "alternateStateApplied": true, "alternateStatePreservedExact": false, "independentStateMutation": true, "completeStateRoundTrip": true}, "runtime": {"installedInstances": 2, "renderedBlocks": 100, "stateSettleBlocks": 8, "bothTracksProcessed": true, "maximumOutputPeak": 0.006893756333739, "maximumTrackOnePeak": 0.006893756333739, "maximumTrackTwoPeak": 0.005762039683759, "averageCallbackLoad": 0.007437900002114, "maximumCallbackLoad": 0.39384999871254, "invalidSamples": 0, "clippedSamples": 0, "processorExceptions": 0, "missingPluginPreserved": true, "shutdownComplete": true}, "passed": true}